id,original_language,overview,release_date,title,popularity,vote_average,vote_count,genre,director,year
451657,fr,"In the midst of a divorce, Miriam Besson decides to ask for exclusive custody of her son, in order to protect him from a father that she is accusing of violence. The judge-in-charge of the file grants a shared custody to the father whom it considers abused. Taken as a hostage between his parents, Julien Besson will do everything to prevent the worst from happening.",2018-02-07,Custody,2.236,7.516,663,Drama,James Lapine,2016
9516,en,A young street hustler attempts to escape the rigors and temptations of the ghetto in a quest for a better life.,1993-05-26,Menace II Society,7.0179,7.516,793,"Drama, Crime, Thriller",Albert Hughes,1993
668742,es,The success of the Conchy virtual assistant (which was developed by Javier) has earned him a favorable spot in the parents chat room - until something unexpected ruins it all.,2020-07-29,Father There Is Only One 2,1.7424,7.515,550,"Comedy, Family",Santiago Segura,2020
607259,en,"A widowed new dad copes with doubts, fears, heartache and dirty diapers as he sets out to raise his daughter on his own. Inspired by a true story.",2021-06-18,Fatherhood,6.6404,7.517,1443,"Drama, Comedy",Paul Weitz,2021
491418,en,"When Pete and Ellie decide to start a family, they stumble into the world of foster care adoption. They hope to take in one small child but when they meet three siblings, including a rebellious 15 year old girl, they find themselves speeding from zero to three kids overnight.",2018-11-13,Instant Family,9.1442,7.515,3023,"Comedy, Drama",Sean Anders,2018
11782,cn,A cop who loses his partner in a shoot-out with gun smugglers goes on a mission to catch them. In order to get closer to the leaders of the ring he joins forces with an undercover cop who's working as a gangster hitman. They use all means of excessive force to find them.,1992-04-16,Hard Boiled,2.4378,7.515,827,"Action, Thriller, Crime",John Woo,1992
592,en,"A paranoid, secretive surveillance expert has a crisis of conscience when he suspects that the couple he is spying on will be murdered.",1974-04-07,The Conversation,5.845,7.515,1838,"Crime, Drama, Mystery",Francis Ford Coppola,1974
221,en,"After moving to a new town, troublemaking teen Jim Stark is supposed to have a clean slate, although being the new kid in town brings its own problems. While searching for some stability, Stark forms a bond with a disturbed classmate, Plato, and falls for local girl Judy. However, Judy is the girlfriend of neighborhood tough, Buzz. When Buzz violently confronts Jim and challenges him to a drag race, the new kid's real troubles begin.",1955-10-27,Rebel Without a Cause,2.8915,7.515,1649,Drama,Nicholas Ray,1955
588228,en,"The world is stunned when a group of time travelers arrive from the year 2051 to deliver an urgent message: Thirty years in the future, mankind is losing a global war against a deadly alien species. The only hope for survival is for soldiers and civilians from the present to be transported to the future and join the fight. Among those recruited is high school teacher and family man Dan Forester. Determined to save the world for his young daughter, Dan teams up with a brilliant scientist and his estranged father in a desperate quest to rewrite the fate of the planet.",2021-09-03,The Tomorrow War,21.566,7.514,3650,"Action, Science Fiction, Adventure",Chris McKay,2021
1859,en,A stern Russian woman sent to Paris on official business finds herself attracted to a man who represents everything she is supposed to detest.,1939-11-23,Ninotchka,1.2684,7.5,391,"Comedy, Romance",Ernst Lubitsch,1939
601,en,"An alien is left behind on Earth and saved by the 10-year-old Elliot who decides to keep him hidden in his home. While a task force hunts for the extra-terrestrial, Elliot, his brother, and his little sister Gertie form an emotional bond with their new friend, and try to help him find his way home.",1982-06-11,E.T. the Extra-Terrestrial,16.1838,7.514,11371,"Science Fiction, Adventure, Family, Fantasy",Steven Spielberg,1982
9340,en,"Young teenager Mikey Walsh finds an old treasure map in his father's attic. Hoping to save their homes from demolition, Mikey and his friends Data, Chunk, and Mouth set off on a quest to find the secret stash of Pirate One-Eyed Willie.",1985-06-07,The Goonies,12.7047,7.513,5828,"Adventure, Comedy, Family",Richard Donner,1985
132344,en,"It has been nine years since we last met Jesse and Celine, the French-American couple who once met on a train in Vienna. They now live in Paris with twin daughters but have spent a summer in Greece at the invitation of an author colleague of Jesse's. When the vacation is over and Jesse must send his teenage son off to the States, he begins to question his life decisions, and his relationship with Celine is at risk.",2013-04-05,Before Midnight,3.6628,7.512,2471,"Romance, Drama",Richard Linklater,2013
11046,en,"World War II is raging, and an American general has been captured and is being held hostage in the Schloss Adler, a Bavarian castle that's nearly impossible to breach. It's up to a group of skilled Allied soldiers to liberate the general before it's too late.",1968-12-04,Where Eagles Dare,3.4014,7.512,909,"Action, Adventure, War",Brian G. Hutton,1968
648,fr,"The story of a gentle-hearted beast in love with a simple and beautiful girl. She is drawn to the repellent but strangely fascinating Beast, who tests her fidelity by giving her a key, telling her that if she doesn't return it to him by a specific time, he will die of grief. She is unable to return the key on time, but it is revealed that the Beast is the genuinely handsome one. A simple tale of tragic love that turns into a surreal vision of death, desire, and beauty.",1946-10-29,Beauty and the Beast,2.3297,7.512,620,"Drama, Fantasy, Romance",Jean Cocteau,1946
11113,en,A snobbish phonetics professor agrees to a wager that he can take a flower girl and make her presentable in high society.,1964-10-21,My Fair Lady,2.7778,7.511,1333,"Comedy, Romance",George Cukor,1964
3767,en,"A gambler discovers an old flame while in Argentina, but she's married to his new boss.",1946-04-25,Gilda,4.4084,7.511,590,"Romance, Drama, Thriller",Charles Vidor,1946
552095,en,"When their latest scheme goes awry, Mayor Humdinger and his nephew Harold accidentally divert a meteor towards Adventure Bay. The meteor's golden energy grants the PAW Patrol superpowers. The heroic Mighty Pups are on a roll to super-save the day.",2018-10-04,PAW Patrol: Mighty Pups,4.0521,7.51,579,"Adventure, Animation, Family, Action",,2018
382614,en,"Susan, a single mother of two, works as a waitress in a small town. Her son, Henry, is an 11-year-old genius who not only manages the family finances but acts as emotional support for his mother and younger brother. When Henry discovers that the girl next door has a terrible secret, he implores Susan to take matters into her own hands.",2017-06-16,The Book of Henry,5.0914,7.51,1302,"Drama, Crime, Thriller",Colin Trevorrow,2017
256040,te,"The young Shivudu is left as a foundling in a small village by his mother. By the time he’s grown up, it has become apparent that he possesses exceptional gifts. He meets the beautiful warrior princess Avanthika and learns that her queen has been held captive for the last 25 years. Shividu sets off to rescue her, discovering his own origins in the process.",2015-07-10,Bāhubali: The Beginning,5.1754,7.5,836,,,
11686,en,"In czarist Russia, a neurotic soldier and his distant cousin formulate a plot to assassinate Napoleon.",1975-06-10,Love and Death,1.6576,7.51,910,"Comedy, History",Woody Allen,1975
5143,en,"Between two Thanksgivings, Hannah's husband falls in love with her sister Lee, while her hypochondriac ex-husband rekindles his relationship with her sister Holly.",1986-02-07,Hannah and Her Sisters,4.9761,7.51,1067,"Comedy, Drama",Woody Allen,1986
877703,en,"The wolves are howling once again, as a terrifying ancient evil emerges in Beacon Hills. Scott McCall, no longer a teenager yet still an Alpha, must gather new allies and reunite trusted friends to fight back against this powerful and deadly enemy.",2023-01-18,Teen Wolf: The Movie,11.7143,7.509,868,,,
599521,en,"Zed and Addison are back at Seabrook High, where, after a groundbreaking semester, they continue to steer both their school and community toward unity. But the arrival of a new group of outsiders – mysterious werewolves – threatens to shake up the newfound peace and causes a rift in Zed and Addison’s budding romance.",2020-06-13,Z-O-M-B-I-E-S 2,3.2202,7.509,456,"Fantasy, Romance, TV Movie",Paul Hoen,2020
179144,it,"Jep Gambardella has seduced his way through the lavish nightlife of Rome for decades, but after his 65th birthday and a shock from the past, Jep looks past the nightclubs and parties to find a timeless landscape of absurd, exquisite beauty.",2013-05-21,The Great Beauty,2.0185,7.509,3147,Drama,Paolo Sorrentino,2013
10110,en,"Jamie Graham, a privileged English boy, is living in Shanghai when the Japanese invade and force all foreigners into prison camps. Jamie is captured with an American sailor, who looks out for him while they are in the camp together. Even though he is separated from his parents and in a hostile environment, Jamie maintains his dignity and youthful spirit, providing a beacon of hope for the others held captive with him.",1987-12-09,Empire of the Sun,4.0606,7.509,1973,"Drama, History, War",Steven Spielberg,1987
4291,ja,"Brash, loudmouthed and opportunistic, Kikujiro is the unlikely companion for Masao who is determined to see the mother he has never met. The two begin a series of adventures which soon turns out to be a whimsical journey of laughter and tears with a wide array of surprises and unique characters along the way.",1999-06-05,Kikujiro,4.1347,7.509,545,"Comedy, Drama",Takeshi Kitano,1999
10734,en,"San Francisco Bay, January 18, 1960. Frank Lee Morris is transferred to Alcatraz, a maximum security prison located on a rocky island. Although no one has ever managed to escape from there, Frank and other inmates begin to carefully prepare an escape plan.",1979-06-22,Escape from Alcatraz,5.8248,7.508,2880,"Drama, Thriller",Don Siegel,1979
966,en,An oppressed Mexican peasant village hires seven gunfighters to help defend their homes.,1960-10-12,The Magnificent Seven,8.1389,7.508,1834,"Western, Action, Adventure",John Sturges,1960
229,en,"Dr. Frankenstein and his monster both turn out to be alive, not killed as previously believed. Dr. Frankenstein wants to get out of the evil experiment business, but when a mad scientist, Dr. Pretorius, kidnaps his wife, Dr. Frankenstein agrees to help him create a new creature.",1935-04-20,Bride of Frankenstein,13.2558,7.5,1008,"Horror, Science Fiction",James Whale,1935
216156,en,A council case worker looks for the relatives of those found dead and alone.,2013-11-28,Still Life,2.3386,7.5,373,,,2013
13413,en,What lengths will a robot undergo to do his job? BURN·E is a dedicated hard working robot who finds himself locked out of his ship. BURN·E quickly learns that completing a simple task can often be a very difficult endeavor.,2008-11-17,BURN·E,0.8803,7.507,745,"Animation, Family, Comedy, Science Fiction",Angus MacLane,2008
13353,en,"Join the Peanuts gang for a timeless adventure as Charlie Brown preps for a party, Snoopy sets his sights on the Red Baron, and Linus patiently awaits a pumpkin patch miracle.",1966-10-27,"It's the Great Pumpkin, Charlie Brown",1.4176,7.507,418,"Family, Animation, TV Movie, Comedy",Bill Melendez,1966
7549,zh,"Huo Yuan Jia became the most famous martial arts fighter in all of China at the turn of the 20th Century. Huo faced personal tragedy but ultimately fought his way out of darkness, defining the true spirit of martial arts and also inspiring his nation. The son of a great fighter who didn't wish for his child to follow in his footsteps, Huo resolves to teach himself how to fight - and win.",2006-01-26,Fearless,4.7959,7.507,1302,"Drama, Action",Ronny Yu,2006
810171,en,"World famous movie star Olivia faces a PR disaster when a paparazzi snaps a photo of her with her married lover, Vincent. The hard-working valet Antonio accidentally appears in the same photo and is enlisted to pose as Olivia’s new boyfriend as a cover-up. This ruse with Olivia thrusts Antonio into the spotlight and unexpected chaos.",2022-05-11,The Valet,4.9711,7.506,576,"Comedy, Romance",Richard Wong,2022
73456,en,"Barbie stars as Blair Willows, a kind-hearted girl who is chosen to attend Princess Charm School: a magical, modern place that teaches dancing, how to have tea parties, and proper princess manners. Blair loves her classes -- as well as the helpful magical sprites and her new friends, Princesses Hadley and Isla. But when royal teacher Dame Devin discovers that Blair looks a lot like the kingdom’s missing princess, she turns Blair’s world upside down to stop her from claiming the throne. Now Blair, Hadley and Delancy must find an enchanted crown to prove Blair’s true identity in this charming and magical princess story!",2011-08-11,Barbie: Princess Charm School,7.0581,7.505,829,"Family, Animation, Fantasy",Ezekiel Norton,2011
16633,en,"Young writer Richard Collier is met on the opening night of his first play by an old lady who begs him to ""Come back to me"". Mystified, he tries to find out about her, and learns that she is a famous stage actress from the early 1900s. Becoming more and more obsessed with her, by self-hypnosis he manages to travel back in time—where he meets her.",1980-10-02,Somewhere in Time,2.2224,7.505,591,"Drama, Fantasy, Romance",Jeannot Szwarc,1980
6620,en,"Linus and David Larrabee are the two sons of a very wealthy family. Linus is all work – busily running the family corporate empire, he has no time for a wife and family. David is all play – technically he is employed by the family business, but never shows up for work, spends all his time entertaining, and has been married and divorced three times. Meanwhile, Sabrina Fairchild is the young, shy, and awkward daughter of the household chauffeur, who goes away to Paris for two years, and returns to capture David's attention, while falling in love with Linus.",1954-09-10,Sabrina,4.6104,7.5,1262,"Comedy, Romance, Drama",Billy Wilder,1954
21734,en,"Just when Charlie is feeling especially frustrated by the lack of excitement in her small town in California, she receives wonderful news: Her uncle and namesake, Charlie, is coming to visit. However, as secrets about him come to the fore, her admiration turns into suspicion.",1943-01-15,Shadow of a Doubt,2.622,7.504,1058,"Thriller, Mystery",Alfred Hitchcock,1943
16642,en,"In 1916, a Chicago steel worker accidentally kills his supervisor and flees to the Texas panhandle with his girlfriend and little sister to work harvesting wheat in the fields of a stoic farmer.",1978-09-13,Days of Heaven,2.0252,7.504,1053,"Drama, Romance",Terrence Malick,1978
16328,en,"A young American soldier, rendered in pseudocoma from an artillery shell from WWI, recalls his life leading up to that point.",1971-08-04,Johnny Got His Gun,1.0224,7.504,386,,,1971
2034,en,"On his first day on the job as a narcotics officer, a rookie cop works with a rogue detective who isn't what he appears.",2001-10-05,Training Day,6.5386,7.504,6103,,,
503919,en,Two lighthouse keepers try to maintain their sanity while living on a remote and mysterious New England island in the 1890s.,2019-10-18,The Lighthouse,11.0294,7.503,5078,"Drama, Fantasy, Thriller",Robert Eggers,2019
21542,en,A high school outcast pays a cheerleader to pose as his girlfriend so he can be considered cool.,2003-12-12,Love Don't Co$t a Thing,11.4677,7.5,577,"Comedy, Drama, Family, Romance",Troy Byer,2003
17809,zh,"Chen Zhen, a Chinese engineering student in Kyoto, who braves the insults and abuse of his Japanse fellow students for his local love Mitsuko Yamada, daughter of the director, returns in 1937 to his native Shangai, under Japanse protectorate -in fact military occupation- after reading about the death of his kung-fu master Hou Ting-An in a fight against the Japanese champion Ryuichi Akutagawa.",1994-12-22,Fist of Legend,3.298,7.5,550,Action,Gordon Chan,1994
15917,hi,"In 1900s India, Calcuttan zamindar Devdas Mukherjee — unable to marry his lover — takes up alcohol and the company of a courtesan to alleviate the pain.",2002-07-11,Devdas,2.042,7.5,347,"Drama, Romance",Sanjay Leela Bhansali,2002
69,en,"A chronicle of country music legend Johnny Cash's life, from his early days on an Arkansas cotton farm to his rise to fame with Sun Records in Memphis, where he recorded alongside Elvis Presley, Jerry Lee Lewis and Carl Perkins.",2005-09-13,Walk the Line,4.8837,7.503,2941,"Drama, Music, Romance",James Mangold,2005
916405,ga,"A quiet, neglected girl is sent away from her dysfunctional family to live with relatives for the summer. She blossoms in their care, but in this house where there are meant to be no secrets, she discovers one.",2022-05-12,The Quiet Girl,3.1509,7.502,449,Drama,Colm Bairéad,2022
544510,fr,"Paris, France, December 1897. The young playwright Edmond Rostand feels like a failure. Inspiration has abandoned him. Married and father of two children, desperate and penniless, he persuades the great actor Constant Coquelin to perform the main role in his new play. But there is a problem: Coquelin wants to premiere it at Christmas and Edmond has not written a single word.",2018-11-10,"Cyrano, My Love",1.5887,7.502,506,"Comedy, History",Alexis Michalik,2018
375262,en,"England, early 18th century. The close relationship between Queen Anne and Sarah Churchill is threatened by the arrival of Sarah's cousin, Abigail Hill, resulting in a bitter rivalry between the two cousins to be the Queen's favourite.",2018-11-23,The Favourite,9.3702,7.502,5590,"History, Comedy, Drama",Yorgos Lanthimos,2018
31767,en,"In 17th-century France, Father Urbain Grandier seeks to protect the city of Loudun from the corrupt establishment of Cardinal Richelieu. Hysteria occurs within the city when he is accused of witchcraft by the sexually repressed Sister Jeanne.",1971-07-16,The Devils,4.3389,7.501,389,"Drama, History, Horror",Ken Russell,1971
11040,en,"Jack Crabb, looking back from extreme old age, tells of his life being raised by Indians and fighting with General Custer.",1970-12-23,Little Big Man,1.9268,7.501,645,"Western, Comedy, Adventure",Arthur Penn,1970
8342,bs,"Two soldiers from opposite sites get stuck between the front lines in the same trench. The UN is asked to free them and both sides agree on a ceasefire, but will they stick to it?",2001-05-12,No Man's Land,2.3223,7.501,455,"Action, History, War",Danis Tanović,2001
786,en,"In 1973, 15-year-old William Miller's unabashed love of music and aspiration to become a rock journalist lands him an assignment from Rolling Stone magazine to interview and tour with the up-and-coming band, Stillwater.",2000-09-15,Almost Famous,8.4661,7.501,2839,"Drama, Music",Cameron Crowe,2000
63311,es,A brilliant plastic surgeon creates a synthetic skin that withstands any kind of damage. His guinea pig: a mysterious and volatile woman who holds the key to his obsession.,2011-08-17,The Skin I Live In,11.6363,7.5,4319,"Drama, Horror, Mystery, Thriller",Pedro Almodóvar,2011
614934,en,"The life story of Elvis Presley as seen through the complicated relationship with his enigmatic manager, Colonel Tom Parker.",2022-06-22,Elvis,10.0009,7.499,3539,"Drama, Music, History",Baz Luhrmann,2022
487558,en,"Colorado Springs, late 1970s. Ron Stallworth, an African American police officer, and Flip Zimmerman, his Jewish colleague, run an undercover operation to infiltrate the Ku Klux Klan.",2018-08-09,BlacKkKlansman,9.8196,7.499,7650,"Crime, Comedy, Drama, History",Spike Lee,2018
11906,it,An American newcomer to a prestigious German ballet academy comes to realize that the school is a front for something sinister amid a series of grisly murders.,1977-02-01,Suspiria,4.5493,7.499,2983,Horror,Dario Argento,1977
10604,el,An uptight English writer traveling to Crete on a matter of business finds his life changed forever when he meets the gregarious Alexis Zorba.,1964-12-14,Zorba the Greek,1.9711,7.499,350,Drama,Mihalis Kakogiannis,1964
1786,fr,"Au revoir les enfants tells a heartbreaking story of friendship and devastating loss concerning two boys living in Nazi-occupied France. At a provincial Catholic boarding school, the precocious youths enjoy true camaraderie—until a secret is revealed. Based on events from writer-director Malle’s own childhood, the film is a subtle, precisely observed tale of courage, cowardice, and tragic awakening.",1987-10-07,Au Revoir les Enfants,2.4678,7.499,668,"Drama, War",Louis Malle,1987
79,zh,"During China's Warring States period, a district prefect arrives at the palace of Qin Shi Huang, claiming to have killed the three assassins who had made an attempt on the king's life three years ago.",2002-07-22,Hero,6.2269,7.499,2303,"Drama, Adventure, Action, History",Zhang Yimou,2002
258480,en,"In 1950s New York, a department-store clerk who dreams of a better life falls for an older, married woman.",2015-11-20,Carol,4.6701,7.498,3762,"Romance, Drama",Todd Haynes,2015
85350,en,"The film tells a story of a divorced couple trying to raise their young son. The story follows the boy for twelve years, from first grade at age 6 through 12th grade at age 17-18, and examines his relationship with his parents as he grows.",2014-06-05,Boyhood,6.3443,7.498,5249,Drama,Richard Linklater,2014
8073,fr,"Cinephile slackers Franz and Arthur spend their days mimicking the antiheroes of Hollywood noirs and Westerns while pursuing the lovely Odile. The misfit trio upends convention at every turn, be it through choreographed dances in cafés or frolicsome romps through the Louvre. Eventually, their romantic view of outlaws pushes them to plan their own heist, but their inexperience may send them out in a blaze of glory -- which could be just what they want.",1964-08-05,Band of Outsiders,1.4789,7.5,577,"Crime, Drama, Comedy",Jean-Luc Godard,1964
3001,en,A woman must steal a statue from a Paris museum to help conceal her father's art forgeries.,1966-07-13,How to Steal a Million,3.5847,7.498,604,"Comedy, Crime, Romance",William Wyler,1966
332562,en,"Seasoned musician Jackson Maine discovers — and falls in love with — struggling artist Ally. She has just about given up on her dream to make it big as a singer — until Jack coaxes her into the spotlight. But even as Ally's career takes off, the personal side of their relationship is breaking down, as Jack fights an ongoing battle with his own internal demons.",2018-10-03,A Star Is Born,7.0327,7.497,11798,"Music, Drama, Romance",Bradley Cooper,2018
11970,en,"Bestowed with superhuman strength, a young mortal named Hercules sets out to prove himself a hero in the eyes of his father, the great god Zeus. Along with his friends Pegasus, a flying horse, and Phil, a personal trainer, Hercules is tricked by the hilarious, hotheaded villain Hades, who's plotting to take over Mount Olympus!",1997-06-13,Hercules,11.6212,7.498,7548,"Animation, Family, Fantasy, Adventure, Comedy, Romance",Ron Clements,1997
776,fr,A weekend at a marquis’ country château lays bare some ugly truths about a group of haut bourgeois acquaintances.,1939-07-09,The Rules of the Game,1.9955,7.5,600,"Drama, Comedy, Romance",Jean Renoir,1939
470878,en,"10-year-old Bart Millard lives with his mother and abusive father Arthur in Texas. One day his mother drops him off at a Christian camp where he meets Shannon. Upon his return from camp, Bart finds his mother has left and movers are removing her belongings. He angrily confronts his father, who denies that his abusiveness was the reason she left. Years later, in high school, Bart and Shannon are dating. Bart plays football to please his father but is injured, breaking both ankles and ending his career. The only elective with openings is music class, so he reluctantly signs up.",2018-02-14,I Can Only Imagine,4.6214,7.5,477,"Music, Drama",Jon Erwin,2018
468284,fr,"After an emotional exchange between a Lebanese Christian and a Palestinian refugee escalates, the men end up in a court case that gets national attention.",2017-09-14,The Insult,0.8554,7.5,457,"Drama, Crime",Ziad Doueiri,2017
31682,en,"A dangerous combination of radiation and insecticide causes the unfortunate Scott Carey to shrink, slowly but surely, until he is only a few inches tall. His home becomes a wilderness where he must survive everything from spiders living in the cellar to his beloved cat.",1957-02-22,The Incredible Shrinking Man,2.9498,7.496,511,"Science Fiction, Drama, Adventure, Horror",Jack Arnold,1957
192,en,"14th-century Franciscan monk William of Baskerville and his young novice arrive at a conference to find that several monks have been murdered under mysterious circumstances. To solve the crimes, William must rise up against the Church's authority and fight the shadowy conspiracy of monastery monks using only his intelligence; which is considerable.",1986-09-24,The Name of the Rose,5.6696,7.496,3087,,,1986
192,en,"14th-century Franciscan monk William of Baskerville and his young novice arrive at a conference to find that several monks have been murdered under mysterious circumstances. To solve the crimes, William must rise up against the Church's authority and fight the shadowy conspiracy of monastery monks using only his intelligence; which is considerable.",1986-09-24,The Name of the Rose,5.6696,7.496,3087,"Drama, Thriller, Mystery",Jean-Jacques Annaud,1986
