id,original_language,overview,release_date,title,popularity,vote_average,vote_count,genre,director,year
759,en,"Lorelei Lee is a beautiful showgirl engaged to be married to the wealthy Gus Esmond, much to the disapproval of Gus' rich father, Esmond Sr., who thinks that Lorelei is just after his money. When Lorelei goes on a cruise accompanied only by her best friend, Dorothy Shaw, Esmond Sr. hires Ernie Malone, a private detective, to follow her and report any questionable behavior that would disqualify her from the marriage.",1953-07-14,Gentlemen Prefer Blondes,4.7428,7.338,989,"Comedy, Romance",Howard Hawks,1953
672208,fa,"Rahim is in prison because of a debt he was unable to repay. During a two-day leave, he tries to convince his creditor to withdraw his complaint against the payment of part of the sum. But things don't go as planned. Is he truly a hero?",2021-12-15,A Hero,1.5323,7.337,337,,,
672208,fa,"Rahim is in prison because of a debt he was unable to repay. During a two-day leave, he tries to convince his creditor to withdraw his complaint against the payment of part of the sum. But things don't go as planned. Is he truly a hero?",2021-12-15,A Hero,1.5323,7.337,337,"Adventure, Action, Animation, Science Fiction",Osamu Kasai,1997
493529,en,"A charming thief and a band of unlikely adventurers undertake an epic heist to retrieve a lost relic, but things go dangerously awry when they run afoul of the wrong people.",2023-03-23,Dungeons & Dragons: Honor Among Thieves,13.8362,7.337,3929,"Adventure, Fantasy, Comedy",John Francis Daley,2023
44018,fr,"Mona Bergeron is dead, her frozen body found in a ditch in the French countryside. From this, the film flashes back to the weeks leading up to her death. Through these flashbacks, Mona gradually declines as she travels from place to place, taking odd jobs and staying with whomever will offer her a place to sleep. Mona is fiercely independent, craving freedom over comfort, but it is this desire to be free that will eventually lead to her demise.",1985-12-04,Vagabond,2.1248,7.337,323,Drama,Agnès Varda,1985
13183,en,"In a gritty and alternate 1985, the glory days of costumed vigilantes have been brought to a close by a government crackdown. But after one of the masked veterans is brutally murdered, an investigation into the killer is initiated. The reunited heroes set out to prevent their own destruction, but in doing so they uncover a sinister plot that puts all of humanity in grave danger.",2009-03-04,Watchmen,9.9028,7.337,9390,"Mystery, Action, Science Fiction",Zack Snyder,2009
9560,en,World War II vet Paul Sutton falls for a pregnant and unwed woman who persuades him -- during their first encounter -- to pose as her husband so she can face her family.,1995-05-27,A Walk in the Clouds,7.2781,7.337,1046,"Drama, Romance",Alfonso Arau,1995
704,en,"Capturing John Lennon, Paul McCartney, George Harrison and Ringo Starr in their electrifying element, 'A Hard Day's Night' is a wildly irreverent journey through this pastiche of a day in the life of The Beatles during 1964. The band have to use all their guile and wit to avoid the pursuing fans and press to reach their scheduled television performance, in spite of Paul's troublemaking grandfather and Ringo's arrest.",1964-07-07,A Hard Day's Night,5.3641,7.3,692,"Comedy, Music",Richard Lester,1964
890980,es,"Alice Gould, a private investigator, pretends to be mentally ill in order to enter a psychiatric hospital and gather evidence for the case she is working on: the death of a patient in unclear circumstances.",2022-10-06,God's Crooked Lines,5.0377,7.3,714,"Drama, Mystery, Thriller",Oriol Paulo,2022
705996,ko,"From a mountain peak in South Korea, a man plummets to his death. Did he jump, or was he pushed? When detective Hae-joon arrives on the scene, he begins to suspect the dead man’s wife Seo-rae. But as he digs deeper into the investigation, he finds himself trapped in a web of deception and desire.",2022-06-29,Decision to Leave,8.9978,7.3,1275,"Thriller, Mystery, Romance",Park Chan-wook,2022
615666,en,"An ordinary young boy called Nikolas sets out on an extraordinary adventure into the snowy north in search of his father who is on a quest to discover the fabled village of the elves, Elfhelm. Taking with him a headstrong reindeer called Blitzen and a loyal pet mouse, Nikolas soon meets his destiny in this magical and endearing story that proves nothing is impossible…",2021-11-24,A Boy Called Christmas,4.4463,7.336,755,"Family, Adventure, Fantasy",Gil Kenan,2021
9065,de,"A young, idealist American gets a job as a train conductor for the Zentropa railway network in postwar, US-occupied Frankfurt. As various people try to take advantage of him, he soon finds his position politically sensitive, and gets caught up in a whirlpool of conspiracies and Nazi sympathisers.",1991-06-27,Europa,2.0234,7.336,327,"Crime, Drama, Thriller",Lars von Trier,1991
5548,en,"In a violent, near-apocalyptic Detroit, evil corporation Omni Consumer Products wins a contract from the city government to privatize the police force. To test their crime-eradicating cyborgs, the company leads street cop Alex Murphy into an armed confrontation with crime lord Boddicker so they can use his body to support their untested RoboCop prototype. But when RoboCop learns of the company's nefarious plans, he turns on his masters.",1987-07-17,RoboCop,13.1621,7.336,5276,"Action, Thriller, Science Fiction",Paul Verhoeven,1987
587792,en,"When carefree Nyles and reluctant maid of honor Sarah have a chance encounter at a Palm Springs wedding, things get complicated when they find themselves unable to escape the venue, themselves, or each other.",2020-07-10,Palm Springs,12.5467,7.335,3259,"Comedy, Romance, Science Fiction",Max Barbakow,2020
132363,en,"A look at the life of Cecil Gaines, who served eight presidents as the White House's head butler from 1952 to 1986, and had a unique front-row seat as political and racial history was made.",2013-08-16,The Butler,4.2058,7.335,2911,Drama,Lee Daniels,2013
15392,en,"A wanna-be blues guitar virtuoso seeks a long-lost song by legendary musician, Robert Johnson.",1986-03-14,Crossroads,2.3286,7.335,439,"Drama, Music, Mystery, Romance",Walter Hill,1986
13688,cn,"A poor construction worker, who struggles to keep his son in private school, mistakes an orb he finds in a junkjard for a toy which proves to be much, much more once the young boy starts to play with it.",2008-01-30,CJ7,4.1751,7.335,729,"Comedy, Drama, Family, Fantasy, Science Fiction",Stephen Chow,2008
1052,en,"A successful mod photographer in London whose world is bounded by fashion, pop music, marijuana, and easy sex, feels his life is boring and despairing. But in the course of a single day he unknowingly captures a death on film.",1966-12-18,Blow-Up,1.9249,7.3,1279,"Drama, Mystery, Thriller",Michelangelo Antonioni,1966
874,en,"A depiction of the conflict between King Henry VIII of England and his Lord Chancellor, Sir Thomas More, who refuses to swear the Oath of Supremacy declaring Henry Supreme Head of the Church in England.",1966-12-13,A Man for All Seasons,3.5467,7.3,445,"Drama, History",Fred Zinnemann,1966
740441,ko,A woman's life is turned upside-down when a dangerous man gets a hold of her lost cell phone and uses it to track her every move.,2023-02-17,Unlocked,5.6437,7.334,343,Thriller,Kim Tae-joon,2023
75656,en,An FBI agent and an Interpol detective track a team of illusionists who pull off bank heists during their performances and reward their audiences with the money.,2013-05-29,Now You See Me,13.044,7.334,15744,"Thriller, Crime",Louis Leterrier,2013
36208,en,The Tramp and his dog companion struggle to survive in the inner city.,1918-04-14,A Dog's Life,1.677,7.334,328,Comedy,Charlie Chaplin,1918
9589,de,"This movie portrays the drug scene in Berlin in the 70s, following tape recordings of Christiane F. 14 years old Christiane lives with her mother and little sister in a typical multi-storey apartment building in Berlin. She's fascinated by the 'Sound', a new disco with most modern equipment. Although she's legally too young, she asks a friend to take her. There she meets Detlef, who's in a clique where everybody's on drugs. Step by step she gets drawn deeper into the scene.",1981-04-02,Christiane F.,4.1395,7.3,1356,Drama,Uli Edel,1981
560057,en,"When a young girl stows away on the ship of a legendary sea monster hunter, they launch an epic journey into uncharted waters — and make history to boot.",2022-06-24,The Sea Beast,9.8362,7.3,1529,"Animation, Adventure, Action, Family, Fantasy",Chris Williams,2022
429174,ru,"Zhenya and Boris are going through a vicious divorce marked by resentment, frustration and recriminations. Already embarking on new lives, each with a new partner, they are impatient to start again, to turn the page – even if it means threatening to abandon their 12-year-old son Alyosha. Until, after witnessing one of their fights, Alyosha disappears.",2017-06-01,Loveless,2.3307,7.333,762,,,2017
2134,en,A Victorian Englishman travels to the far future and finds that humanity has divided into two hostile species.,1960-05-25,The Time Machine,4.3466,7.3,847,"Thriller, Adventure, Fantasy, Science Fiction, Romance",George Pal,1960
377,en,"Teenagers in a small town are dropping like flies, apparently in the grip of mass hysteria causing their suicides. A cop's daughter, Nancy Thompson, traces the cause to child molester Fred Krueger, who was burned alive by angry parents many years before. Krueger has now come back in the dreams of his killers' children, claiming their lives as his revenge. Nancy and her boyfriend, Glen, must devise a plan to lure the monster out of the realm of nightmares and into the real world...",1984-11-09,A Nightmare on Elm Street,28.0231,7.332,5285,Horror,Wes Craven,1984
1100099,en,"An up-and-coming chef and a recent divorcée find their lives forever changed when a chance encounter brings them together, in a decade-spanning, deeply moving romance.",2024-10-10,We Live in Time,14.6835,7.332,795,"Romance, Drama",John Crowley,2024
621013,en,"When a hopelessly romantic high school senior falls for a mysterious new classmate, it sets them both on an unexpected journey that teaches them about love, loss, and most importantly themselves.",2020-08-21,Chemical Hearts,4.5064,7.3,1125,"Drama, Romance",Richard Tanne,2020
416477,en,"Pakistan-born comedian Kumail Nanjiani and grad student Emily Gardner fall in love but struggle as their cultures clash. When Emily contracts a mysterious illness, Kumail finds himself forced to face her feisty parents, his family's expectations, and his true feelings.",2017-03-30,The Big Sick,11.1615,7.332,2473,"Comedy, Drama, Romance",Michael Showalter,2017
407449,en,"Follows the journey of a 90-year-old atheist and the quirky characters that inhabit his off-the-map desert town. He finds himself at the precipice of life, thrust into a journey of self-exploration.",2017-09-29,Lucky,3.8063,7.332,589,Drama,John Carroll Lynch,2017
324552,en,"John Wick is forced out of retirement by a former associate looking to seize control of a shadowy international assassins’ guild. Bound by a blood oath to aid him, Wick travels to Rome and does battle against some of the world’s most dangerous killers.",2017-02-08,John Wick: Chapter 2,14.6809,7.332,13366,"Action, Thriller, Crime",Chad Stahelski,2017
118406,ja,"Sixteen years ago, a mysterious masked ninja unleashes a powerful creature known as the Nine-Tailed Demon Fox on the Hidden Leaf Village Konoha, killing many people. In response, the Fourth Hokage Minato Namikaze and his wife Kushina Uzumaki, the Demon Fox's living prison or Jinchūriki, manage to seal the creature inside their newborn son Naruto Uzumaki. With the Tailed Beast sealed, things continued as normal. However, in the present day, peace ended when a group of ninja called the Akatsuki attack Konoha under the guidance of Tobi, the mysterious masked man behind Fox's rampage years ago who intends on executing his plan to rule the world by shrouding it in illusions.",2012-07-28,Road to Ninja: Naruto the Movie,5.3907,7.332,1196,,,2012
61791,en,"A highly intelligent chimpanzee named Caesar has been living a peaceful suburban life ever since he was born. But when he gets taken to a cruel primate facility, Caesar decides to revolt against those who have harmed him.",2011-08-03,Rise of the Planet of the Apes,14.3824,7.3,12128,"Thriller, Action, Drama, Science Fiction",Rupert Wyatt,2011
12140,ja,"Cyborg detective Batou is assigned to investigate a series of murders committed by gynoids—doll-like cyborgs, which all malfunctioned, killed, then self-destructed afterwards. The brains of the gynoids initialize in order to protect their manufacturer's software, but in one gynoid, which Batou himself neutralized, one file remains: a voice speaking the phrase ""Help me.""",2004-03-06,Ghost in the Shell 2: Innocence,2.7487,7.3,880,"Animation, Drama, Science Fiction",Mamoru Oshii,2004
315635,en,"Following the events of Captain America: Civil War, Peter Parker, with the help of his mentor Tony Stark, tries to balance his life as an ordinary high school student in Queens, New York City, with fighting crime as his superhero alter ego Spider-Man as a new threat, the Vulture, emerges.",2017-07-05,Spider-Man: Homecoming,57.3578,7.331,22149,"Action, Adventure, Science Fiction",Jon Watts,2017
88,en,"Expecting the usual tedium that accompanies a summer in the Catskills with her family, 17-year-old Frances 'Baby' Houseman is surprised to find herself stepping into the shoes of a professional hoofer—and unexpectedly falling in love.",1987-08-21,Dirty Dancing,12.5663,7.331,6221,"Drama, Music, Romance",Emile Ardolino,1987
342737,en,"In 1979 Santa Barbara, California, Dorothea Fields is a determined single mother in her mid-50s who is raising her adolescent son, Jamie, at a moment brimming with cultural change and rebellion. Dorothea enlists the help of two younger women – Abbie, a free-spirited punk artist living as a boarder in the Fields' home and Julie, a savvy and provocative teenage neighbour – to help with Jamie's upbringing.",2016-12-28,20th Century Women,2.4107,7.33,1157,Drama,Mike Mills,2016
119450,en,"A group of scientists in San Francisco struggle to stay alive in the aftermath of a plague that is wiping out humanity, while Caesar tries to maintain dominance over his community of intelligent apes.",2014-07-08,Dawn of the Planet of the Apes,11.5092,7.3,11641,"Science Fiction, Action, Drama, Thriller",Matt Reeves,2014
15764,en,"Stingo, a young writer, moves to Brooklyn in 1947 to begin work on his first novel. As he becomes friendly with Sophie and her lover Nathan, he learns that she is a Holocaust survivor. Flashbacks reveal her harrowing story, from pre-war prosperity to Auschwitz. In the present, Sophie and Nathan's relationship increasingly unravels as Stingo grows closer to Sophie and Nathan's fragile mental state becomes ever more apparent.",1982-12-08,Sophie's Choice,3.1336,7.3,868,"Drama, Romance, War",Alan J. Pakula,1982
866398,en,One man's campaign for vengeance takes on national stakes after he is revealed to be a former operative of a powerful and clandestine organization known as Beekeepers.,2024-01-08,The Beekeeper,25.1273,7.33,3493,,,2024
239877,it,"While Arturo tries to gain the love of Flora, he witnesses the history of Sicily from 1969 to 1992, miraculously dodging the crimes of the Mafia and supporting as a journalist the heroic struggle of the judges and policemen who fought this infamous organization.",2013-11-28,The Mafia Kills Only in Summer,0.6759,7.329,1111,"Romance, Comedy, Crime, Drama",Pif,2013
10549,en,"Hamlet, Prince of Denmark, returns home to find his father murdered and his mother now marrying the murderer... his uncle. Meanwhile, war is brewing.",1996-12-25,Hamlet,1.9708,7.329,484,Drama,Kenneth Branagh,1996
191714,hi,"A mistaken delivery in Mumbai's famously efficient lunchbox delivery system (Mumbai's Dabbawallahs) connects a young housewife to a stranger in the dusk of his life. They build a fantasy world together through notes in the lunchbox. Gradually, this fantasy threatens to overwhelm their reality.",2013-09-20,The Lunchbox,2.5725,7.328,724,"Drama, Romance",Ritesh Batra,2013
58857,ja,A bravado period action film set at the end of Japan's feudal era in which a group of unemployed samurai are enlisted to bring down a sadistic lord and prevent him from ascending to the throne and plunging the country into a war-torn future.,2010-09-09,13 Assassins,4.8063,7.328,1166,"Adventure, Drama, Action",Takashi Miike,2010
15003,th,"Zen, an autistic teenage girl with powerful martial arts skills, gets money to pay for her sick mother Zin's treatment by seeking out all the people who owe Zin money and making them pay.",2008-02-06,Chocolate,1.6147,7.328,510,"Action, Crime",Prachya Pinkaew,2008
964980,en,Discover the game-changing partnership between a then undiscovered Michael Jordan and Nike's fledgling basketball division which revolutionized the world of sports and culture with the Air Jordan brand.,2023-04-05,Air,14.0071,7.327,2048,"Drama, History",Ben Affleck,2023
72478,pl,"Moody, dark and handsome Dominik is tormented by his classmates after video footage of his drunken kiss with bully Alex is spread across the Internet. Grappling with the public humiliation Dominik seeks solace in an avatar based “suicide room” where the pink-haired rebel Sylvia consoles him.",2011-03-04,Suicide Room,2.2975,7.327,462,"Drama, Thriller",Jan Komasa,2011
13008,en,"The true story of suburban housewife Gertrude Baniszewski, who kept a teenage girl locked in the basement of her Indiana home during the 1960s.",2007-07-27,An American Crime,3.222,7.327,713,"Crime, Drama, Horror",Tommy O'Haver,2007
11673,fr,"Famed swordsman and poet Cyrano de Bergerac is in love with his cousin Roxane. He has never expressed his love for her as he his large nose undermines his self-confidence. Then he finds a way to express his love to her, indirectly.",1990-03-28,Cyrano de Bergerac,1.5925,7.327,776,"Drama, Comedy, History, Romance",Jean-Paul Rappeneau,1990
10975,cn,"Hired by a Spanish baron, Hong Kong treasure hunter Jackie, a.k.a. ""Asian Hawk"" and his entourage seek WWII Nazi gold buried in the Sahara Desert.",1991-02-07,Operation Condor,3.6733,7.327,570,"Action, Adventure, Crime, Thriller",Jackie Chan,1991
1830,en,"Yuri Orlov is a globetrotting arms dealer and, through some of the deadliest war zones, he struggles to stay one step ahead of a relentless Interpol agent, his business rivals and even some of his customers who include many of the world's most notorious dictators. Finally, he must also face his own conscience.",2005-09-16,Lord of War,7.1921,7.327,4916,"Crime, Drama, Thriller",Andrew Niccol,2005
21348,fr,"Drawn from elements of West African folk tales, it depicts how a newborn boy, Kirikou, saves his village from the evil witch Karaba.",1998-12-09,Kirikou and the Sorceress,2.6473,7.3,1109,"Fantasy, Adventure, Animation, Family",Michel Ocelot,1998
11305,en,"In Memphis, Tennessee, over the course of a single night, the Arcade Hotel, run by an eccentric night clerk and a clueless bellboy, is visited by a young Japanese couple traveling in search of the roots of rock; an Italian woman in mourning who stumbles upon a fleeing charlatan girl; and a comical trio of accidental thieves looking for a place to hide.",1989-09-06,Mystery Train,1.7205,7.326,457,Comedy,Jim Jarmusch,1989
802,en,"Humbert Humbert is a middle-aged British novelist who is both appalled by and attracted to the vulgarity of American culture. When he comes to stay at the boarding house run by Charlotte Haze, he soon becomes obsessed with Lolita, the woman's teenaged daughter.",1962-06-13,Lolita,6.1557,7.326,2109,,,
506528,en,"The extraordinary tale of Harriet Tubman's escape from slavery and transformation into one of America's greatest heroes. Her courage, ingenuity and tenacity freed hundreds of slaves and changed the course of history.",2019-11-01,Harriet,6.7423,7.324,820,"Drama, History",Kasi Lemmons,2019
47735,sv,"Monika from Stockholm falls in love with Harry, a young man on holiday. When she becomes pregnant they are forced into a marriage, which begins to fall apart soon after they take up residence in a cramped little flat.",1953-02-09,Summer with Monika,2.0763,7.325,357,"Drama, Romance",Ingmar Bergman,1953
14447,en,"Wallace and Gromit open a bakery, accidentally getting tied up with a murder mystery in the process. But when Wallace falls in love, Gromit is left to solve the case by himself.",2008-12-25,A Matter of Loaf and Death,1.4552,7.325,543,"Family, Animation, Comedy, Mystery",Nick Park,2008
205587,en,"A successful lawyer returns to his hometown for his mother's funeral only to discover that his estranged father, the town's judge, is suspected of murder.",2014-10-08,The Judge,6.4745,7.324,4180,Drama,David Dobkin,2014
122917,en,"Following Smaug's attack on Laketown, Bilbo and the dwarves try to defend Erebor's mountain of treasure from others who claim it: the men of the ruined Laketown and the elves of Mirkwood. Meanwhile an army of Orcs led by Azog the Defiler is marching on Erebor, fueled by the rise of the dark lord Sauron. Dwarves, elves and men must unite, and the hope for Middle-Earth falls into Bilbo's hands.",2014-12-10,The Hobbit: The Battle of the Five Armies,18.6983,7.324,14566,"Action, Adventure, Fantasy",Peter Jackson,2014
2666,en,"A man struggles with memories of his past, including a wife he cannot remember, in a nightmarish world with no sun and run by beings with telekinetic powers who seek the souls of humans.",1998-02-27,Dark City,4.6354,7.324,2892,"Mystery, Science Fiction",Alex Proyas,1998
470,en,"Paul Rivers, an ailing mathematician lovelessly married to an English émigré; Christina Peck, an upper-middle-class suburban housewife and mother of two girls; and Jack Jordan, a born-again ex-con, are brought together by a terrible accident that changes their lives.",2003-09-06,21 Grams,5.9654,7.324,3182,"Drama, Crime, Thriller",Alejandro González Iñárritu,2003
615173,ko,"A girl wakes up in a huge secret laboratory, then accidentally meets another girl who is trying to protect her house from a gang. The mystery girl overthrows the gang with her unexpected powers, and laboratory staff set out to find her.",2022-06-15,The Witch: Part 2. The Other One,16.0678,7.323,358,"Action, Mystery, Thriller, Science Fiction",Park Hoon-jung,2022
90369,en,A girl dying of leukemia compiles a list of things she'd like to do before passing away. Topping the list is her desire to lose her virginity.,2012-09-19,Now Is Good,3.2808,7.3,1082,"Drama, Romance",Ol Parker,2012
1429,en,"In New York City in the days following the events of 9/11, Monty Brogan is a convicted drug dealer about to start a seven-year prison sentence, and his final hours of freedom are devoted to hanging out with his closest buddies and trying to prepare his girlfriend for his extended absence.",2002-12-19,25th Hour,2.8927,7.323,2407,"Crime, Drama",Spike Lee,2002
504608,en,"The story of Elton John's life, from his years as a prodigy at the Royal Academy of Music through his influential and enduring musical partnership with Bernie Taupin.",2019-05-17,Rocketman,6.8339,7.322,4738,"Music, Drama",Dexter Fletcher,2019
442065,en,"The incredible true story of Vietnam War hero William H. Pitsenbarger, a U.S. Air Force Pararescuemen medic who personally saved over sixty men. Thirty-two years later, Pentagon staffer Scott Huffman investigates a Congressional Medal of Honor request for Pitsenbarger and uncovers a high-level conspiracy behind the decades-long denial of the medal, prompting Huffman to put his own career on the line to seek justice for the fallen airman.",2020-01-23,The Last Full Measure,4.9224,7.322,454,,,2020
250538,en,"A young refugee of the Sudanese Civil War who wins a lottery for relocation to the United States with three other lost boys. Encountering the modern world for the first time, they develop an unlikely friendship with a brash American woman assigned to help them, but the young man struggles to adjust to this new life and his feelings of guilt about the brother he left behind.",2014-09-10,The Good Lie,3.5963,7.3,497,Drama,Philippe Falardeau,2014
112198,fr,"Vincent, a wealthy real estate agent, is invited to dinner by his sister Elizabeth and her husband Peter, both professors in Paris. Claude, a childhood friend and trombonist in a symphony orchestra, is also present. Vincent brings news from the prenatal examination of his and his wife Anna's unborn son.  The name chosen by the soon-to-be parents strongly offends the others for many reasons. The dispute between the guests quickly escalates and before long the resurgence of old grudges and hidden secrets is unavoidable ...",2012-04-25,What's in a Name,1.9323,7.322,1716,Comedy,Matthieu Delaporte,2012
18785,en,"When three friends finally come to after a raucous night of bachelor-party revelry, they find a baby in the closet and a tiger in the bathroom. But they can't seem to locate their best friend, Doug – who's supposed to be tying the knot. Launching a frantic search for Doug, the trio perseveres through a nasty hangover to try to make it to the church on time.",2009-06-02,The Hangover,22.5905,7.322,17194,Comedy,Todd Phillips,2009
2841,fr,"Young Frenchwoman Mathilde searches for the truth about her missing fiancé, lost during World War I, and learns many unexpected things along the way. The love of her life is gone. But she refuses to believe he's gone forever — and she needs to know for sure.",2004-10-27,A Very Long Engagement,2.5358,7.322,1230,"Drama, Romance, War",Jean-Pierre Jeunet,2004
