id,original_language,overview,release_date,title,popularity,vote_average,vote_count,genre,director,year
348892,hi,A young mute girl from Pakistan loses herself in India with no way to head back. A devoted man with a magnanimous spirit undertakes the task to get her back to her motherland and unite her with her family.,2015-07-17,Bajrangi Bhaijaan,3.6442,7.788,495,"Comedy, Drama, Action",Kabir Khan,2015
5991,de,"An aging doorman, after being fired from his prestigious job at a luxurious hotel is forced to face the scorn of his friends, neighbours and society.",1924-12-23,The Last Laugh,1.4158,7.788,312,Drama,F. W. Murnau,1924
31056,pl,"19-year-old Tomek whiles away his lonely life by spying on his opposite neighbour Magda through binoculars. She's an artist in her mid-thirties, and appears to have everything - not least a constant stream of men at her beck and call. But when the two finally meet, they discover that they have a lot more in common than appeared at first sight...",1988-08-21,A Short Film About Love,1.6882,7.8,378,"Drama, Romance",Krzysztof Kieślowski,1988
12496,ja,"Seibei Iguchi leads a difficult life as a low ranking samurai at the turn of the nineteenth century. A widower with a meager income, Seibei struggles to take care of his two daughters and senile mother. New prospects seem to open up when the beautiful Tomoe, a childhood friend, comes back into he and his daughters' life, but as the Japanese feudal system unravels, Seibei is still bound by the code of honor of the samurai and by his own sense of social precedence. How can he find a way to do what is best for those he loves?",2002-11-02,The Twilight Samurai,1.3608,7.787,321,"Drama, Romance",Yoji Yamada,2002
1366,en,An uneducated collector for a Philadelphia loan shark is given a once-in-a-lifetime opportunity to fight against the world heavyweight boxing champion.,1976-11-20,Rocky,9.2193,7.787,8050,Drama,John G. Avildsen,1976
359156,it,"A story set in the 90s and in the outskirts of Rome to Ostia. A world where money, luxury cars, night clubs, cocaine and synthetic drugs are easy to run. A world in which Vittorio and Cesare, in their early twenties, act in search of their success.",2015-09-08,Don't Be Bad,1.9121,7.786,987,"Crime, Drama",Claudio Caligari,2015
934,fr,"Out of prison after a five-year stretch, jewel thief Tony turns down a quick job his friend Jo offers him, until he discovers that his old girlfriend Mado has become the lover of local gangster Pierre Grutter during Tony's absence. Expanding a minor smash-and-grab into a full-scale jewel heist, Tony and his crew appear to get away clean, but their actions after the job is completed threaten the lives of everyone involved.",1955-04-13,Rififi,2.087,7.786,577,"Crime, Thriller, Drama",Jules Dassin,1955
277216,en,"In 1987, five young men, using brutally honest rhymes and hardcore beats, put their frustration and anger about life in the most dangerous place in America into the most powerful weapon they had: their music.  Taking us back to where it all began, Straight Outta Compton tells the true story of how these cultural rebels—armed only with their lyrics, swagger, bravado and raw talent—stood up to the authorities that meant to keep them down and formed the world’s most dangerous group, N.W.A.  And as they spoke the truth that no one had before and exposed life in the hood, their voice ignited a social revolution that is still reverberating today.",2015-08-11,Straight Outta Compton,7.7828,7.785,3968,"Drama, Music, History",F. Gary Gray,2015
149870,ja,"A lifelong love of flight inspires Japanese aviation engineer Jiro Horikoshi, whose storied career includes the creation of the A-6M World War II fighter plane.",2013-07-20,The Wind Rises,4.5759,7.785,3105,"Drama, Animation, Romance, War, History",Hayao Miyazaki,2013
15859,ko,A young couple's love is tested when Sun-jin is diagnosed with a rare form of Alzheimer's disease.,2004-11-05,A Moment to Remember,2.0479,7.785,328,"Drama, Romance",John H. Lee,2004
887,en,"It's the hope that sustains the spirit of every GI: the dream of the day when he will finally return home. For three WWII veterans, the day has arrived. But for each man, the dream is about to become a nightmare.",1946-12-25,The Best Years of Our Lives,4.7869,7.8,668,"Drama, Romance",William Wyler,1946
49026,en,"Following the death of District Attorney Harvey Dent, Batman assumes responsibility for Dent's crimes to protect the late attorney's reputation and is subsequently hunted by the Gotham City Police Department. Eight years later, Batman encounters the mysterious Selina Kyle and the villainous Bane, a new terrorist leader who overwhelms Gotham's finest. The Dark Knight resurfaces to protect a city that has branded him an enemy.",2012-07-17,The Dark Knight Rises,20.6244,7.784,23152,,,2012
142,en,"In 1960s Wyoming, two men develop a strong emotional and sexual relationship that endures as a lifelong connection complicating their lives as they get married and start families of their own.",2005-10-22,Brokeback Mountain,10.669,7.784,7129,"Drama, Romance",Ang Lee,2005
71157,fr,"Paris, France. Fred and his colleagues, members of the BPM, the Police Child Protection Unit, dedicated to pursuing all sorts of offenses committed against the weakest, must endure the scrutiny of Melissa, a photographer commissioned to graphically document the daily routine of the team.",2011-10-06,Polisse,2.3662,7.783,1246,"Drama, Crime",Maïwenn,2011
1675,fr,"A committed film director struggles to complete his movie while coping with a myriad of crises, personal and professional, among the cast and crew.",1973-05-24,Day for Night,1.0825,7.783,605,"Comedy, Drama",François Truffaut,1973
438631,en,"Paul Atreides, a brilliant and gifted young man born into a great destiny beyond his understanding, must travel to the most dangerous planet in the universe to ensure the future of his family and his people. As malevolent forces explode into conflict over the planet's exclusive supply of the most precious resource in existence-a commodity capable of unlocking humanity's greatest potential-only those who can conquer their fear will survive.",2021-09-15,Dune,25.2012,7.782,13448,"Science Fiction, Adventure",Denis Villeneuve,2021
14069,ja,"When 17-year-old Makoto Konno gains the ability to, quite literally, ""leap"" backwards through time, she immediately sets about improving her grades and preventing personal mishaps. However, she soon realises that changing the past isn't as simple as it seems, and eventually, will have to rely on her new powers to shape the future of herself and her friends.",2006-07-15,The Girl Who Leapt Through Time,3.7538,7.78,2065,,,2006
5000,fr,"Orphaned after a Nazi air raid, Paulette, a young Parisian girl, runs into Michel, an older peasant boy, and the two quickly become close. Together, they try to make sense of the chaotic and crumbling world around them, attempting to cope with death as they create a burial ground for Paulette's deceased pet dog. Eventually, however, Paulette's stay with Michel's family is threatened by the harsh realities of wartime.",1952-05-09,Forbidden Games,1.9648,7.78,318,"Drama, War",René Clément,1952
262,en,"Aspiring comic Rupert Pupkin attempts to achieve success in show business by stalking his idol, a late night talk-show host who craves his own privacy.",1982-12-18,The King of Comedy,6.6602,7.78,2374,"Drama, Comedy",Martin Scorsese,1982
585511,en,"Suddenly finding herself in the never-before-seen Land of Luck, the unluckiest person in the world must unite with the magical creatures there to turn her luck around.",2022-08-05,Luck,17.8826,7.779,1782,"Animation, Adventure, Comedy, Fantasy",Peggy Holmes,2022
11602,sv,"Karin hopes to recover from her recent stay at a mental hospital by spending the summer at her family's cottage on a tiny island. Her husband, Martin, cares for her but is frustrated by her physical withdrawal. Her younger brother, Minus, is confused by Karin's vulnerability and his own budding sexuality. Their father, David, cannot overcome his haughty remoteness. Beset by visions, Karin descends further into madness.",1961-10-16,Through a Glass Darkly,0.9135,7.777,500,Drama,Ingmar Bergman,1961
9421,fr,"For Pierre Brochant and his friends, Wednesday is “Idiots' Day”. The idea is simple: each person has to bring along an idiot. The one who brings the most spectacular idiot wins the prize. Tonight, Brochant is ecstatic. He has found a gem. The ultimate idiot, “A world champion idiot!”. What Brochant doesn’t know is that Pignon is a real jinx, a past master in the art of bringing on catastrophes...",1998-04-15,The Dinner Game,3.2471,7.776,1943,Comedy,Francis Veber,1998
712454,fr,A photojournalist's obsessive quest for the truth about the first expedition to Mt. Everest leads him to search for an esteemed climber who went missing.,2021-09-22,The Summit of the Gods,1.945,7.775,366,"Animation, Adventure, Mystery",Patrick Imbert,2021
11005,en,"Dr. Malcolm Sayer, a shy research physician, uses an experimental drug to ""awaken"" the catatonic victims of a rare disease. Leonard is the first patient to receive the controversial treatment. His awakening, filled with awe and enthusiasm, proves a rebirth for Sayer too, as the exuberant patient reveals life's simple but unutterably sweet pleasures to the introverted doctor.",1990-12-04,Awakenings,4.6079,7.775,2622,Drama,Penny Marshall,1990
428493,en,"A young farmer in rural Yorkshire numbs his daily frustrations with binge drinking and casual sex, until the arrival of a Romanian migrant worker.",2017-08-31,God's Own Country,5.2803,7.774,922,"Romance, Drama",Francis Lee,2017
5961,sv,"As children in the loving Ekdahl family, Fanny and Alexander enjoy a happy life with their parents, who run a theater company. After their father dies unexpectedly, however, the siblings end up in a joyless home when their mother, Emilie, marries a stern bishop. The bleak situation gradually grows worse as the bishop becomes more controlling, but dedicated relatives make a valiant attempt to aid Emilie, Fanny and Alexander.",1982-12-17,Fanny and Alexander,2.7728,7.772,795,"Fantasy, Drama, Mystery",Ingmar Bergman,1982
6844,en,"Escaping death, a Hebrew infant is raised in a royal household to become a prince. Upon discovery of his true heritage, Moses embarks on a personal quest to reclaim his destiny as the leader and liberator of the Hebrew people.",1956-10-05,The Ten Commandments,35.7585,7.772,1688,"Drama, History",Cecil B. DeMille,1956
144,de,"Two angels, Damiel and Cassiel, glide through the streets of Berlin, observing the bustling population, providing invisible rays of hope to the distressed but never interacting with them. When Damiel falls in love with lonely trapeze artist Marion, the angel longs to experience life in the physical world, and finds -- with some words of wisdom from actor Peter Falk -- that it might be possible for him to take human form.",1987-09-23,Wings of Desire,3.0707,7.771,1366,,,
169813,en,"Grace, a compassionate young supervisor at a foster care facility, helps at-risk teens. But when a new charge dredges up memories of her own troubled past, Grace's tough exterior begins eroding.",2013-08-23,Short Term 12,1.9823,7.77,1320,Drama,Destin Daniel Cretton,2013
141,en,"After narrowly escaping a bizarre accident, a troubled teenager is plagued by visions of a large bunny rabbit that manipulates him to commit a series of crimes.",2001-01-19,Donnie Darko,19.3428,7.77,12698,"Fantasy, Drama, Mystery",Richard Kelly,2001
715931,en,"Inspired by the gripping true story of a man who would do anything for his family—and for freedom. When Peter, an enslaved man, risks his life to escape and return to his family, he embarks on a perilous journey of love and endurance.",2022-12-02,Emancipation,11.3878,7.769,1161,"Drama, War, History",Antoine Fuqua,2022
165,en,"Marty and Doc are at it again as the time-traveling duo head to 2015 to nip some McFly family woes in the bud. But things go awry thanks to bully Biff Tannen and a pesky sports almanac. In a last-ditch attempt to set things straight, Marty finds himself bound for 1955 and face to face with his teenage parents -- again.",1989-11-22,Back to the Future Part II,8.3532,7.769,13076,"Adventure, Comedy, Science Fiction",Robert Zemeckis,1989
25050,ja,A family gathers together for a commemorative ritual whose nature only gradually becomes clear.,2008-06-28,Still Walking,1.4074,7.768,386,"Drama, Family",Hirokazu Kore-eda,2008
946,en,"A pianist about to flee from a duel receives a letter from a woman he cannot remember. As she tells the story of her lifelong love for him, he is forced to reinterpret his own past.",1948-04-28,Letter from an Unknown Woman,1.9746,7.768,311,"Drama, Romance",Max Ophüls,1948
553,en,"When beautiful young Grace arrives in the isolated township of Dogville, the small community agrees to hide her from a gang of ruthless gangsters, and, in return, Grace agrees to do odd jobs for the townspeople.",2003-05-21,Dogville,7.0695,7.768,2474,"Crime, Drama, Thriller",Lars von Trier,2003
126319,fr,"Celestine is a little mouse trying to avoid a dental career while Ernest is a big bear craving an artistic outlet. When Celestine meets Ernest, they overcome their natural enmity by forging a life of crime together.",2012-12-12,Ernest & Celestine,1.9459,7.767,619,"Animation, Family, Adventure, Crime",Vincent Patar,2012
22504,fr,"A young shepherdess and a chimneysweep plan to get married and escape the clutches of a tyrannical king in love with her, assisted by the guile of a cheeky mockingbird, the king's archenemy.",1980-03-19,The King and the Mockingbird,1.3986,7.767,380,"Animation, Family, Fantasy",Paul Grimault,1980
18079,es,"Two con artists try to swindle a stamp collector by selling him a sheet of counterfeit rare stamps (the ""nine queens"").",2000-08-31,Nine Queens,3.215,7.767,733,"Crime, Thriller, Drama",Fabián Bielinsky,2000
5511,fr,"After carrying out a flawlessly planned hit, Jef Costello, a contract killer with samurai instincts, finds himself caught between a persistent police investigator and a ruthless employer, and not even his armor of fedora and trench coat can protect him.",1967-10-25,Le Samouraï,4.6183,7.765,1139,"Crime, Thriller, Drama",Jean-Pierre Melville,1967
423612,de,"German artist Kurt Barnert has escaped East Germany and now lives in West Germany, but is tormented by his childhood under the Nazis and the GDR regime.",2018-10-03,Never Look Away,3.3114,7.764,685,"Drama, Romance, History",Florian Henckel von Donnersmarck,2018
980489,en,The ultimate wish-fulfillment tale of a teenage Gran Turismo player whose gaming skills won him a series of Nissan competitions to become an actual professional racecar driver.,2023-08-09,Gran Turismo,13.7717,7.763,2921,"Adventure, Action, Drama",Neill Blomkamp,2023
51533,zh,"When circumstances force an outlaw to impersonate a county governor and clean up a corrupt town, the Robin Hood figure finds himself in a showdown with the local godfather.",2010-12-20,Let the Bullets Fly,3.5237,7.8,304,,,
583,en,"Brian Cohen is an average young Jewish man, but through a series of ridiculous events, he gains a reputation as the Messiah. When he's not dodging his followers or being scolded by his shrill mother, the hapless Brian has to contend with the pompous Pontius Pilate and acronym-obsessed members of a separatist movement. Rife with Monty Python's signature absurdity, the tale finds Brian's life paralleling Biblical lore, albeit with many more laughs.",1979-08-17,Life of Brian,8.8136,7.762,4544,Comedy,Terry Jones,1979
17483,en,"Forced to give up his dreams of art school, Zach works dead-end jobs to support his sister and her son. Questioning his life, he paints, surfs and hangs out with his best friend, Gabe. When Gabe's older brother returns home for the summer, Zach suddenly finds himself drawn into a relationship he didn't expect.",2007-06-16,Shelter,4.1358,7.761,481,"Drama, Romance",Jonah Markowitz,2007
15916,ja,"In a desolate and dark world full of shadows, lives one little girl who seems to do nothing but collect water in jars and protect a large egg she carries everywhere. A mysterious man enters her life... and they discuss the world around them.",1985-12-15,Angel's Egg,2.9984,7.761,439,"Animation, Fantasy, Mystery",Mamoru Oshii,1985
873,en,"An epic tale spanning forty years in the life of Celie, an African-American woman living in the South who survives incredible abuse and bigotry. After Celie's abusive father marries her off to the equally debasing 'Mister' Albert Johnson, things go from bad to worse, leaving Celie to find companionship anywhere she can. She perseveres, holding on to her dream of one day being reunited with her sister in Africa.",1985-12-18,The Color Purple,7.3611,7.76,1832,"Drama, History",Steven Spielberg,1985
545611,en,"An aging Chinese immigrant is swept up in an insane adventure, where she alone can save what's important to her by connecting with the lives she could have led in other universes.",2022-03-24,Everything Everywhere All at Once,21.5967,7.76,6980,"Action, Adventure, Science Fiction",Daniel Scheinert,2022
216,de,"Emmi Kurowski, a cleaning lady, is lonely in her old age. Her husband died years ago, and her grown children offer little companionship. One night she goes to a bar frequented by Arab immigrants and strikes up a friendship with middle-aged mechanic Ali. Their relationship soon develops into something more, and Emmi's family and neighbors criticize their spontaneous marriage. Soon Emmi and Ali are forced to confront their own insecurities about their future.",1974-03-05,Ali: Fear Eats the Soul,2.3211,7.8,412,"Romance, Drama",Rainer Werner Fassbinder,1974
86837,fr,"Georges and Anne are in their eighties. They are cultivated, retired music teachers. Their daughter, who is also a musician, lives abroad with her family. One day, Anne has a stroke, and the couple's bond of love is severely tested.",2012-09-20,Amour,3.8486,7.759,1661,"Drama, Romance",Michael Haneke,2012
14756,cn,"A semi-biographical account of Yip Man, the first martial arts master to teach the Chinese martial art of Wing Chun. The film focuses on events surrounding Ip that took place in the city of Foshan between the 1930s to 1940s during the Second Sino-Japanese War. Directed by Wilson Yip, the film stars Donnie Yen in the lead role, and features fight choreography by Sammo Hung.",2008-12-12,Ip Man,3.3354,7.759,3842,"Drama, Action, History",Wilson Yip,2008
587,en,"Throughout his life Edward Bloom has always been a man of big appetites, enormous passions and tall tales. In his later years, he remains a huge mystery to his son, William. Now, to get to know the real man, Will begins piecing together a true picture of his father from flashbacks of his amazing adventures.",2003-12-25,Big Fish,9.7776,7.759,7336,"Adventure, Fantasy, Drama",Tim Burton,2003
117,en,"Elliot Ness, an ambitious prohibition agent, is determined to take down Al Capone. In order to achieve this goal, he forms a group given the nickname “The Untouchables”.",1987-06-03,The Untouchables,7.5262,7.759,5775,"Crime, History, Thriller",Brian De Palma,1987
783675,ja,"Shohoku's “speedster” and point guard, Ryota Miyagi, always plays with brains and lightning speed, running circles around his opponents while feigning composure. In his second year of high school, Ryota plays with the Shohoku High School basketball team along with Sakuragi, Rukawa, Akagi, and Mitsui as they take the stage at the Inter-High School National Championship. And now, they are on the brink of challenging the reigning champions, Sannoh Kogyo High School.",2022-12-03,The First Slam Dunk,8.1846,7.757,448,"Animation, Comedy, Drama",Takehiko Inoue,2022
609242,es,"In 2006, a group of thieves performed what is considered one of the most famous and smart bank heists in the history of Argentina. How they robbed the Rio bank is as surprising as what happened afterwards. This is their story.",2020-01-16,The Heist of the Century,2.3601,7.757,799,"Comedy, Thriller, Crime",Ariel Winograd,2020
113833,en,"The story of the onset of the HIV-AIDS crisis in New York City in the early 1980s, taking an unflinching look at the nation's sexual politics as gay activists and their allies in the medical community fight to expose the truth about the burgeoning epidemic to a city and nation in denial.",2014-05-25,The Normal Heart,1.8397,7.8,883,,,
28162,en,"When a young RAF pilot miraculously survives bailing out of his aeroplane without a parachute, he falls in love with an American radio operator. But the officials in the other world realise their mistake and dispatch an angel to collect him.",1946-12-15,A Matter of Life and Death,3.5792,7.757,425,"Romance, Fantasy, Drama, Comedy",Emeric Pressburger,1946
10229,en,"When the popular, restless Landon Carter is forced to participate in the school drama production, he falls in love with Jamie Sullivan, the daughter of the town's minister. Jamie has a ""to-do"" list for her life, as well as a very big secret she must keep from Landon.",2002-01-25,A Walk to Remember,11.0885,7.757,4092,"Drama, Romance",Adam Shankman,2002
937278,en,"When a lively young family moves in next door, grumpy widower Otto Anderson meets his match in a quick-witted, pregnant woman named Marisol, leading to an unlikely friendship that turns his world upside down.",2022-12-28,A Man Called Otto,17.0778,7.757,3069,"Comedy, Drama",Marc Forster,2022
652722,es,"Victor (William Levy) is one of the world’s most handsome  men, but he has a deep secret – he is a cold blooded assassin. Smooth talking and seductive, Victor was raised to do one thing only, which is to kill for money. When he is sent to the home of a brutal drug lord to collect payment for his most recent hit, he encounters the beautiful Sarai (Alicia Sanz), who has been forced to spend the last 9 years of her life with the drug lord.",2019-12-06,In the Arms of an Assassin,3.6597,7.756,424,,,
579974,te,A fictional history of two legendary revolutionaries' journey away from home before they began fighting for their country in the 1920s.,2022-03-24,RRR,11.5297,7.754,1388,"Action, Adventure, Drama",S. S. Rajamouli,2022
273248,en,Bounty hunters seek shelter from a raging blizzard and get caught up in a plot of betrayal and deception.,2015-12-25,The Hateful Eight,8.777,7.8,14471,"Drama, Mystery, Western",Quentin Tarantino,2015
13855,ko,"Joong-ho is a dirty detective turned pimp in financial trouble as several of his girls have recently disappeared without clearing their debts. While trying to track them down, he finds a clue that the vanished girls were all called up by the same client whom one of his girls is meeting with right now.",2008-02-14,The Chaser,3.4343,7.754,1374,"Crime, Thriller, Action",Na Hong-jin,2008
1417,es,"Living with her tyrannical stepfather in a new home with her pregnant mother, 10-year-old Ofelia feels alone until she explores a decaying labyrinth guarded by a mysterious faun who claims to know her destiny. If she wishes to return to her real father, Ofelia must complete three terrifying tasks.",2006-10-10,Pan's Labyrinth,10.5274,7.754,10741,"Fantasy, Drama, War",Guillermo del Toro,2006
882569,en,"During the war in Afghanistan, a local interpreter risks his own life to carry an injured sergeant across miles of grueling terrain.",2023-04-19,Guy Ritchie's The Covenant,17.567,7.8,2720,,,
203217,pt,"After another spat with her kids, Dona Hermínia decides to take some time off from them and hides away in her aunt's house, where she reminisces about her kids in an age when they still needed her.",2013-06-21,My Mom Is a Character,1.8014,7.753,661,,,
380,en,"When car dealer Charlie Babbitt learns that his estranged father has died, he returns home to Cincinnati, where he discovers that he has a savant older brother named Raymond and that his father's $3 million fortune is being left to the mental institution in which Raymond lives. Motivated by his father's money, Charlie checks Raymond out of the facility in order to return with him to Los Angeles. The brothers' cross-country trip ends up changing both their lives.",1988-12-12,Rain Man,7.3758,7.754,6525,Drama,Barry Levinson,1988
396535,ko,"When a zombie virus pushes Korea into a state of emergency, those trapped on an express train to Busan must fight for their own survival.",2016-07-20,Train to Busan,22.9705,7.751,7730,"Horror, Thriller, Action, Adventure",Yeon Sang-ho,2016
24480,en,"Everyone knows that the stork delivers babies, but where do the storks get the babies from? The answer lies up in the stratosphere, where cloud people sculpt babies from clouds and bring them to life. Gus, a lonely and insecure grey cloud, is a master at creating ""dangerous"" babies. Crocodiles, porcupines, rams and more - Gus's beloved creations are works of art, but more than a handful for his loyal delivery stork partner, Peck. As Gus's creations become more and more rambunctious, Peck's job gets harder and harder. How will Peck manage to handle both his hazardous cargo and his friend's fiery temperament?",2009-05-28,Partly Cloudy,1.3649,7.8,1048,"Animation, Family, Comedy, Fantasy",Peter Sohn,2009
808,en,"It ain't easy bein' green -- especially if you're a likable (albeit smelly) ogre named Shrek. On a mission to retrieve a gorgeous princess from the clutches of a fire-breathing dragon, Shrek teams up with an unlikely compatriot -- a wisecracking donkey.",2001-05-18,Shrek,36.7806,7.75,17608,"Animation, Comedy, Fantasy, Adventure, Family",Andrew Adamson,2001
143,en,"When a group of idealistic young men join the German Army during the Great War, they are assigned to the Western Front, where their patriotism is destroyed by the harsh realities of combat.",1930-04-29,All Quiet on the Western Front,2.8858,7.751,830,"Drama, War",Lewis Milestone,1930
